{
  "$schema": "../schemas/room.schema.json",
  "id": "lintel-field",
  "title": "Lintel Field",
  "shortDescription": "Fallen gate-stones and one scratch that is newer than lichen.",
  "longDescription": "A field of fallen lintels, none of them standing like the ring to the west. Stoneward Kern sits on the driest one with a chalk stub and a veteran’s patience.\nWest is the standing stones. North is the black ditch. South is salt-grass.",
  "zone": "east-moor",
  "map": {
    "x": 9,
    "y": 1
  },
  "exits": [
    {
      "direction": "west",
      "toRoomId": "standing-stones"
    },
    {
      "direction": "north",
      "toRoomId": "black-ditch"
    },
    {
      "direction": "south",
      "toRoomId": "salt-grass"
    }
  ],
  "fixtures": [
    {
      "id": "npc-stoneward-kern",
      "name": "Stoneward Kern",
      "kind": "npc",
      "lookDescription": "A badger in a stone-dust coat, chalk on one claw. Try talk kern.",
      "examineDescription": "A badger in a stone-dust coat, chalk worn down to a stub in one claw, the tally-book buttoned into an inside pocket. Two old tears in the coat are mended with wire rather than thread, because wire was what he had. He has stood a gate on this moor in weather that walked, and he will tell you the number of stones before he tells you anything about the barrow.",
      "dialogue": "Kern has a tally-board propped against a fallen lintel, and every stone in the field carries a chalk dot. \"Eight. I counted them last winter, I chalked them, and I wrote eight in the book.\" He puts his paw flat on the ninth stone. \"This one has a fresh scratch and no dot. I did not put either of those there, and I have been the only animal in this field since the frost. Talk kern if you want the rest of it.\""
    },
    {
      "id": "object-scratch-stone",
      "name": "Scratch Stone",
      "kind": "object",
      "lookDescription": "A lintel with a fresh scratch. Examine it.",
      "examineDescription": "Eight lintels wear old lichen. The ninth scratch is pale, a mason's three circles and then a line through them, as if someone started the abbey mark and refused to finish. Kern's chalk is a dot beside it, not the scratch itself."
    }
  ]
}
