{
  "$schema": "../schemas/room.schema.json",
  "id": "mist-lane",
  "title": "Mist Lane",
  "shortDescription": "A lane where mist sits at knee height and does not lift.",
  "longDescription": "The lane runs between byre and mere. Mist sits at the knee and does not lift when you ask it to. If the fold-hound still keeps this path, it will look like a dog until it does not.\nSouth is the wool shed. West is the byre. North is the mere.",
  "zone": "east-moor",
  "map": {
    "x": 7,
    "y": 3
  },
  "exits": [
    {
      "direction": "south",
      "toRoomId": "wool-shed"
    },
    {
      "direction": "west",
      "toRoomId": "croft-byre"
    },
    {
      "direction": "north",
      "toRoomId": "reed-mere"
    }
  ],
  "fixtures": [
    {
      "id": "object-lane-mist",
      "name": "Lane Mist",
      "kind": "object",
      "lookDescription": "Mist at knee height. Examine it.",
      "examineDescription": "The mist sits at knee height along the whole lane and smells of wet fleece. Walk through it and it closes behind you without holding the shape of your passing. The hedge on both sides is dry. Only the lane is like this."
    }
  ]
}
