{
  "$schema": "../schemas/room.schema.json",
  "id": "hearth-stone",
  "title": "Hearth of Stone",
  "shortDescription": "Granite takes the weight and does not complain.",
  "longDescription": "The Hearth of Stone is a vaulted room that feels older than the hall that leads to it. Granite blocks fit as if they had chosen one another. Dust hangs in cool light. A carved keystone watches the door. The air smells of wet rock after rain and the faint chalk of a mason's mark.\nMentor Quern stands like another block that learned to speak.\nA straw hearth dummy stands where a lesson can be finished without guessing.",
  "zone": "schools",
  "map": {
    "x": 4,
    "y": -1
  },
  "exits": [
    {
      "direction": "north",
      "toRoomId": "hall-of-schools"
    },
    {
      "direction": "east",
      "toRoomId": "hearth-veil"
    }
  ],
  "fixtures": [
    {
      "id": "npc-mentor-quern",
      "name": "Mentor Quern",
      "kind": "npc",
      "lookDescription": "A massive grey badger with granite-dusted paws and a mason's belt. Try talk quern.",
      "examineDescription": "Quern's stripe is pale with stone-dust. The belt is heavy. He does not hurry a sentence, and he does not drop one.",
      "dialogue": "Quern has a granite block up on the bench, chalked in lines. \"Stone is carrying weight without making a speech about it. Feet first.\" He looks at the straw dummy in the corner. \"Talk quern when you are ready.\"",
      "dialogueTree": {
        "start": "welcome",
        "nodes": {
          "welcome": {
            "text": "\"Wet rock after rain. Mason's chalk. The keystone watching the door. Look around this hearth. Weight first. Speech second. Then attack the hearth dummy in here, mine and not the one Flint keeps out in his orchard, unless you are still learning the spark on his. Come back and talk to me. I will open this School's leaf and ink its stem.\"",
            "choices": [
              {
                "say": "1",
                "label": "What does the Primer ask?",
                "next": "craft"
              },
              {
                "say": "2",
                "label": "I will go.",
                "next": "go"
              }
            ]
          },
          "craft": {
            "text": "\"The Field Primer is your book. I open this School's leaf and ink the stem after you look around this hearth, defeat the dummy, and talk to me. Later the Primer holds ink. Open the book and type ink and the vein's name. Carry the weight you named.\"",
            "choices": [
              {
                "say": "1",
                "label": "I understand.",
                "next": "go"
              }
            ]
          },
          "go": {
            "text": "\"Look around this hearth. Defeat the dummy. I will be here. I do not hurry a sentence, and I will not drop this one.\""
          },
          "lessons-done": {
            "text": "\"The stem is inked. Cast keystone at the hearth dummy for the second lesson. After that, the Primer holds one ink. Open the book and type ink and the vein's name.\""
          },
          "third-lesson": {
            "text": "\"Chalk is down. Talk to Headmaster Alder in the High Study, up from the Great Hall. If he has you on the Clock Tower stair, finish it first. When he says the grounds will teach the rest, come back and talk to me.\""
          },
          "third-done": {
            "text": "\"This hearth is done with you, and I will not stretch it out. Each lesson off the grounds leaves one ink in the Primer, and I sign the page whether I am at your shoulder or not.\" He puts his paw on the keystone. \"Keeper Holm kept a stair lit so first-years would not walk it in the dark. He was a mole who understood weight. Eat something warm before you walk a cold road.\""
          }
        }
      }
    },
    {
      "id": "object-stone-keystone",
      "name": "Carved Keystone",
      "kind": "object",
      "lookDescription": "Examine for a closer look.",
      "examineDescription": "The keystone is plain except for a shallow mark like a held breath. The blocks around it have not shifted. A slate says: 'Carry the weight you named.'"
    }
  ]
}
