{
  "$schema": "../schemas/room.schema.json",
  "id": "east-gate",
  "title": "East Gate",
  "shortDescription": "A broad oak gate opens toward a clover-bright meadow.",
  "longDescription": "The oak gate stands between pillars threaded with honeysuckle. Iron swallows perch along its hinges; one has been polished bright by the touch of arriving travellers.\nMeadow air brings the smell of rain and clover. A wayboard points north to the Porter Lodge, south to the dormitories, and west toward the blue lanterns of the court.",
  "zone": "academy-core",
  "map": {
    "x": 1,
    "y": 0
  },
  "exits": [
    {
      "direction": "west",
      "toRoomId": "lantern-court"
    },
    {
      "direction": "east",
      "toRoomId": "east-meadow"
    },
    {
      "direction": "north",
      "toRoomId": "porter-lodge"
    },
    {
      "direction": "south",
      "toRoomId": "dormitory-oak"
    }
  ],
  "fixtures": [
    {
      "id": "npc-collegian-quire",
      "name": "Collegian Quire",
      "kind": "npc",
      "lookDescription": "A third-year vole waits at the gate with her boots already laced. Try talk quire.",
      "examineDescription": "A vole two years ahead of you, dressed for the moor road: boots laced high, satchel strapped down, hood up against weather that has not arrived yet. Her right paw is ink-stained to the second joint. She keeps checking the satchel's side pocket and finding it empty, which is how you know she has already checked it four times.",
      "dialogue": "Quire has her boots laced and her satchel strapped, and she keeps patting an empty side pocket. \"I am walking to the moor road within the hour and my ink is sitting on a desk in the Scriptorium. Third time this term.\" She gives up on the pocket. \"I cannot go back for it and keep the light. Talk quire if you have legs and an hour.\""
    },
    {
      "id": "object-wayboard",
      "name": "Wayboard",
      "kind": "object",
      "lookDescription": "Examine for a closer look.",
      "examineDescription": "The carved arrows are unusually legible. NORTH: Porter Lodge, then east for the Infirmary. SOUTH: Oak and Willow dormitories. WEST: Lantern Court. EAST: East Meadow. NORTH-OF-MEADOW: moor road, Wren's croft — type north from the clover, not from this gate. Below them, Porter has written: 'Lost is a place everyone visits. Ask for directions.'"
    }
  ]
}
