{
  "$schema": "../schemas/room.schema.json",
  "id": "lantern-court",
  "title": "Lantern Court",
  "shortDescription": "Blue lanterns drift beneath the welcoming arms of an ancient oak.",
  "longDescription": "Ancient oak branches arch over a circular courtyard paved with warm, uneven stones. Blue lanterns hang in the leaves like cold glass, and they drift when the wind finds them.\nA mossy well sits at the oak's roots, bucket ready for anyone who has been practicing too hard. Porter Bramble keeps a cheerful watch beside a noticeboard crowded with curling paper. Footpaths lead toward the hall, the orchard, the cloister, and the gate; somewhere below their roots, a low note seems to answer the wind.",
  "zone": "academy-core",
  "map": {
    "x": 0,
    "y": 0
  },
  "exits": [
    {
      "direction": "north",
      "toRoomId": "great-hall"
    },
    {
      "direction": "east",
      "toRoomId": "east-gate"
    },
    {
      "direction": "west",
      "toRoomId": "west-cloister"
    },
    {
      "direction": "south",
      "toRoomId": "south-orchard"
    }
  ],
  "fixtures": [
    {
      "id": "npc-porter-bramble",
      "name": "Porter Bramble",
      "kind": "npc",
      "lookDescription": "A sturdy hedgehog porter in a worn brown coat, brass whistle on a leather cord. Try talk porter.",
      "examineDescription": "Bramble's coat has seen weather and still looks ready for the next arrival. His quills are tidy, his whistle is for calling help, and he greets you as if the Collegium has been waiting.",
      "dialogue": "\"This is a school. We train woodland students to face real dangers in the Greenwood. Typed commands are how you learn. Type look, say hello, take key, then north to reach the Great Hall. Type talk porter and answer with say 1 or say 2 if you want more.\"",
      "dialogueTree": {
        "start": "welcome",
        "nodes": {
          "welcome": {
            "text": "\"Welcome, new Collegian! I am Porter Bramble. Come in under the oak — the blue lanterns hang in the leaves like cold glass, and the well at the roots is cold and ready if you have been practicing too hard. This is the Collegium — a school. Woodland students learn here to face real dangers in the Greenwood. This is where the animals are trained. Typed commands are how you learn. Walk with me through Arrival. The coat is worn. The whistle is for calling help. I have waited through worse weather than you.\"",
            "choices": [
              { "say": "1", "label": "What should I type first?", "next": "commands" },
              { "say": "2", "label": "Why does the Greenwood matter?", "next": "greenwood" },
              { "say": "3", "label": "I am ready to walk.", "next": "ready" }
            ]
          },
          "school": {
            "text": "\"The Collegium is a school. Woodland students learn here to face real dangers in the Greenwood — not a storybook wood, but the real one beyond these lanterns, where the paths get wet and the night does not wait for a first-year to finish a sentence. This is where the animals are trained. Typed commands are how you learn. The oak has heard every arrival. It is still listening.\"",
            "choices": [
              { "say": "1", "label": "What should I type first?", "next": "commands" },
              { "say": "2", "label": "Why does the Greenwood matter?", "next": "greenwood" },
              { "say": "3", "label": "I am ready to walk.", "next": "ready" }
            ]
          },
          "commands": {
            "text": "\"Type look to see Lantern Court — the oak, the drifting blue lanterns, the mossy well, the noticeboard with its curling paper. Type say hello so the roll is not empty beside your name. Type take key; it is still in my paw, worn smooth by other first-years who thought they could skip it. Then type north to reach the Great Hall, where the stone still holds the day's warmth.\"",
            "choices": [
              { "say": "1", "label": "Repeat the school’s purpose.", "next": "school" },
              { "say": "yes", "label": "I understand.", "next": "ready" },
              { "say": "no", "label": "Say that again more slowly.", "next": "commands" }
            ]
          },
          "greenwood": {
            "text": "\"Outside these lanterns the wood is not a storybook. The Greenwood has wet paths, hungry nights, and things that do not wait for a first-year to finish a sentence. Students train here first — look, speak, take, walk north — so they are not surprised later. I have waited through worse weather than you. The whistle is for calling help, not for decoration.\"",
            "choices": [
              { "say": "1", "label": "What should I type first?", "next": "commands" },
              { "say": "2", "label": "I am ready.", "next": "ready" }
            ]
          },
          "ready": {
            "text": "\"Good. Stay with me through Arrival. Type take key if you have not — the metal is warm from my paw — then type north to reach the Great Hall. I will mention this again in the next room. I always do. Nagging is in the coat. The lanterns will still be drifting when you look back.\""
          },
          "nag-look": {
            "text": "\"A new room, and you still have not typed look. I described it. That does not count. Type look. I will walk. I will ask again.\"",
            "choices": [
              { "say": "1", "label": "What should I type first?", "next": "commands" },
              { "say": "2", "label": "I am working on it.", "next": "nag-persist" },
              { "say": "3", "label": "Please stop following me.", "next": "nag-persist" }
            ]
          },
          "nag-speak": {
            "text": "\"Fresh stones. Same problem. I have not heard say hello. The roll is empty next to your name. Type say hello. I can wait. I have waited through worse weather than you.\"",
            "choices": [
              { "say": "1", "label": "What should I type first?", "next": "commands" },
              { "say": "2", "label": "I am working on it.", "next": "nag-persist" },
              { "say": "3", "label": "Please stop following me.", "next": "nag-persist" }
            ]
          },
          "nag-take": {
            "text": "\"Do you see my paw? The key is still in it. Type take key. I will mention this in the next doorway. And the one after that. I am a porter. Nagging is in the coat.\"",
            "choices": [
              { "say": "1", "label": "What should I type first?", "next": "commands" },
              { "say": "2", "label": "I am working on it.", "next": "nag-persist" },
              { "say": "3", "label": "Please stop following me.", "next": "nag-persist" }
            ]
          },
          "nag-arrive": {
            "text": "\"This is a fine room. It is not the Great Hall. From Lantern Court, type north. I will trot. I will whistle. I will not get bored. You might.\"",
            "choices": [
              { "say": "1", "label": "What should I type first?", "next": "commands" },
              { "say": "2", "label": "I am working on it.", "next": "nag-persist" },
              { "say": "3", "label": "Please stop following me.", "next": "nag-persist" }
            ]
          },
          "nag-persist": {
            "text": "\"Stop following you? No. Arrival is not finished. I am wonderfully patient. Type say 1 if you want the commands again.\"",
            "choices": [
              { "say": "1", "label": "What should I type first?", "next": "commands" },
              { "say": "yes", "label": "Fine. Tell me again.", "next": "commands" },
              { "say": "no", "label": "I will type it myself.", "next": "ready" }
            ]
          }
        }
      }
    },
    {
      "id": "object-noticeboard",
      "name": "Noticeboard",
      "kind": "object",
      "lookDescription": "Examine for a closer look.",
      "examineDescription": "NEED A FIRST ADVENTURE? Talk to Porter for directions. Librarian Quill seeks careful readers in the Library Stacks, west of the Great Hall. Groundskeeper Tansy needs observant helpers in the Herb Garden, west of the South Orchard. Headmaster Alder listens for an impossible bell in the High Study after first lessons. Type up from the Great Hall. After that report, the Clock Tower stair opens downward. After the queen, north from the East Meadow for Shepherd Wren.\nTry talk porter. Examine named objects with examine or x. Type quests for your checklist."
    },
    {
      "id": "object-courtyard-well",
      "name": "Courtyard Well",
      "kind": "object",
      "lookDescription": "A mossy stone well at the oak's roots. Type drink well to restore health and focus.",
      "examineDescription": "The water is cold and clear. A wooden bucket and dipper wait on the rim. Type drink well after a hard lesson; it restores both health and focus. A little of each also returns as you rest."
    }
  ]
}
