{
  "$schema": "../schemas/room.schema.json",
  "id": "hearth-thorn",
  "title": "Hearth of Thorns",
  "shortDescription": "Living briar holds the glass and the light.",
  "longDescription": "The Hearth of Thorns is half cloister and half greenhouse. Briar has been trained into trellises that remember every cut, and green light pools on the stone like water held in a leaf. Shears hang where a first-year can reach them and a second-year has learned not to rush. The air smells of crushed sap, damp earth, and the faint sweetness of something flowering out of season.\nMentor Briar waits among the living walls as if the plants had asked her to stay.\nA straw hearth dummy stands where a lesson can be finished without guessing.",
  "zone": "schools",
  "map": {
    "x": 5,
    "y": 1
  },
  "exits": [
    {
      "direction": "south",
      "toRoomId": "hearth-ember"
    },
    {
      "direction": "west",
      "toRoomId": "hearth-steel"
    },
    {
      "direction": "north",
      "toRoomId": "hearth-stars"
    }
  ],
  "fixtures": [
    {
      "id": "npc-mentor-briar",
      "name": "Mentor Briar",
      "kind": "npc",
      "lookDescription": "A scarred hedgehog in a green cloak caught with thorns, shears at the belt. Try talk briar.",
      "examineDescription": "Briar's quills are patched with old scratches. The cloak is mended with vine-thread. She speaks as if the plants were listening, and they usually are.",
      "dialogue": "\"Look around this hearth. The briar remembers every cut. Defeat the hearth dummy in this room. Come back and talk to me. I will open this School's leaf and ink its stem in your Field Primer.\"",
      "dialogueTree": {
        "start": "welcome",
        "nodes": {
          "welcome": {
            "text": "\"Green light. Crushed sap. Shears where you can reach them. Look around this hearth. The plants are listening. Then attack the hearth dummy in this room — not Flint's orchard dummy, unless you are still learning the spark. Come back and talk to me. I will open this School's leaf and ink its stem.\"",
            "choices": [
              {
                "say": "1",
                "label": "What does the Primer ask?",
                "next": "craft"
              },
              {
                "say": "2",
                "label": "I will go.",
                "next": "go"
              }
            ]
          },
          "craft": {
            "text": "\"The Field Primer is your book, not a pressed flower. I open this School's leaf and ink the stem after you look around this hearth, defeat the dummy, and talk to me. Later the Primer holds ink. Open the book and type ink and the vein's name. Growth that is not named will snare you.\"",
            "choices": [
              {
                "say": "1",
                "label": "I understand.",
                "next": "go"
              }
            ]
          },
          "go": {
            "text": "\"Look around this hearth. Defeat the dummy. I will be here among the living walls. The shears stay sharp. So do I.\""
          },
          "lessons-done": {
            "text": "\"The stem is inked. Cast briar at the hearth dummy for the second lesson — a vine trained, not a snare left to wander. After that, the Primer holds one ink. Open the book and type ink and the vein's name.\""
          },
          "third-lesson": {
            "text": "\"Talk to Headmaster Alder in the High Study. Type up from the Great Hall. If he is still sending you down the Clock Tower stair, finish that first. When he says the grounds will teach the rest, come back and talk to me.\""
          },
          "third-done": {
            "text": "\"College lessons in this hearth are complete. Keep the Primer. Each new lesson grants one ink. I still sign the page even when I am not at your shoulder. Holm kept a stair so first-years would not walk it dark. Eat something warm before you take a cold road.\""
          }
        }
      }
    },
    {
      "id": "object-thorn-trellis",
      "name": "Briar Trellis",
      "kind": "object",
      "lookDescription": "Examine for a closer look.",
      "examineDescription": "The living wood has been trained into a door that is also a warning. New growth is tied, not broken. A slate says: 'Ask before you cut.'"
    }
  ]
}
