{
  "$schema": "../schemas/room.schema.json",
  "id": "clock-tower",
  "title": "Clock Tower",
  "shortDescription": "Patient gears count the hours beneath an empty bell frame.",
  "longDescription": "The stair coils around a timber spine polished by generations of paws and hands. Brass gears turn with the solemn concentration of beetles; every seventh tooth has been painted blue by someone who clearly lost count.\nAbove the clock face hangs an empty bell frame. Wind moves through its ropes, but the deep humming comes from the timber beneath your feet. A tighter stair continues down.",
  "zone": "academy-core",
  "map": {
    "x": 1,
    "y": 2
  },
  "exits": [
    {
      "direction": "west",
      "toRoomId": "north-quad"
    },
    {
      "direction": "down",
      "toRoomId": "bell-stair"
    }
  ],
  "fixtures": [
    {
      "id": "object-empty-bell-frame",
      "name": "Empty Bell Frame",
      "kind": "object",
      "lookDescription": "Examine for a closer look.",
      "examineDescription": "The frame has no bell and no clapper. The ropes are dry. Press the supporting oak and three slow pulses rise from below. The sound is not a swing. Something under the tower is answering the wood, and Alder wants that written down."
    }
  ]
}
